4485,Contributing to the Graphics stack on FreeBSD Help us improve our packages and kernel drivers,Jean-Sébastien Pédron,accepted confirmed,2016-01-31,11:10:00,K.4.601,00:45:00
4464,"Could Haiku ever become a BSD? What BSD gave us, what we could still gain from it.",François Revol,accepted confirmed,2016-01-31,13:05:00,K.4.601,00:35:00
4527,EdgeBSD: Status report Living on the edge,Pierre Pronchery,accepted confirmed,2016-01-31,09:00:00,K.4.601,01:00:00
3858,ElectroBSD - Getting a reproducible BSD out of the door ,Fabian Keil,accepted confirmed,2016-01-31,14:35:00,K.4.601,01:00:00
4451,FreeBSD/Xen update News from FreeBSD and Xen,"Roger Pau Monné, Wei Liu",accepted confirmed,2016-01-31,12:00:00,K.4.601,01:00:00
4551,Interesting Things You Can Do With ZFS ,Allan Jude,accepted reconfirmed,2016-01-31,10:05:00,K.4.601,01:00:00
3960,Open/LibreSSL in FreeBSD State of OpenSSL and LibreSSL in ports and base,Bernard Spil,accepted confirmed,2016-01-31,13:45:00,K.4.601,00:45:00
4489,Reproducible builds in FreeBSD packages ,Baptiste Daroussin,accepted confirmed,2016-01-31,15:40:00,K.4.601,01:00:00
